{
  "schema": "scenereplay.game-metadata/1.0",
  "id": "building.gameplay",
  "anchors": [
    {
      "id": "building.door-interaction",
      "role": "game/interaction-point",
      "nodeId": "building.root",
      "transform": {
        "position": { "x": 0, "y": 0.6, "z": -0.8 },
        "eulerAngles": { "x": 0, "y": 0, "z": 0 },
        "scale": { "x": 1, "y": 1, "z": 1 }
      },
      "tags": ["door", "interactable"]
    }
  ],
  "damageZones": [],
  "colliders": [
    {
      "id": "building.main-collider",
      "nodeId": "building.walls",
      "kind": "box",
      "isTrigger": false,
      "center": { "x": 0, "y": 0, "z": 0 },
      "size": { "x": 1, "y": 1, "z": 1 },
      "radius": 0.5,
      "height": 1
    }
  ],
  "lods": [
    { "level": 0, "screenRelativeHeight": 0.45, "nodeIds": ["building.foundation", "building.walls", "building.roof", "building.chimney"] }
  ],
  "tags": ["building", "environment", "small-town"]
}
